{
  "$schema": "https://yen-gov.github.io/schemas/result.constituency.schema.json",
  "$schema_version": "3.1",
  "sources": [
    {
      "url": "https://www.eci.gov.in/eci-backend/public/all_files/AE-2024-statistical-report-AR/10-Detailed-Results.xlsx",
      "fetched_at": "2026-05-12T18:39:14Z"
    },
    {
      "url": "https://www.eci.gov.in/eci-backend/public/all_files/AE-2024-statistical-report-AR/3-List-Of-Political-Parties-Participated.xlsx",
      "fetched_at": "2026-05-12T18:39:15Z"
    }
  ],
  "election": "AcGenJun2024",
  "state": "S02",
  "body": "AC",
  "eci_no": 56,
  "constituency_name": "Khonsa West (ST)",
  "totals": {
    "electors": 11882,
    "votes_polled": 10213,
    "turnout_pct": 85.95
  },
  "candidates": [
    {
      "rank": 1,
      "name": "Chakat Aboh",
      "party_eci_code": "369",
      "party_short": "BJP",
      "votes": 4093,
      "vote_share_pct": 40.08,
      "is_winner": true
    },
    {
      "rank": 2,
      "name": "Yang Sen Matey",
      "party_short": "NCP",
      "votes": 3289,
      "vote_share_pct": 32.2
    },
    {
      "rank": 3,
      "name": "Azet Homtok",
      "party_short": "IND",
      "votes": 1972,
      "vote_share_pct": 19.31
    },
    {
      "rank": 4,
      "name": "Gawang Hakhun",
      "party_short": "PPA",
      "votes": 466,
      "vote_share_pct": 4.56
    },
    {
      "rank": 5,
      "name": "Tangse Tekwa",
      "party_eci_code": "742",
      "party_short": "INC",
      "votes": 316,
      "vote_share_pct": 3.09
    }
  ],
  "nota": {
    "votes": 77,
    "vote_share_pct": 0.75
  },
  "top_n_cutoff": 5,
  "winner": {
    "name": "Chakat Aboh",
    "party_eci_code": "369",
    "party_short": "BJP",
    "votes": 4093,
    "margin_votes": 804,
    "margin_pct": 7.87
  },
  "others": null
}
