{
  "$schema": "https://yen-gov.github.io/schemas/result.constituency.schema.json",
  "$schema_version": "3.1",
  "sources": [
    {
      "url": "https://www.eci.gov.in/eci-backend/public/all_files/AE-2024-statistical-report-SK/10-Detailed-Results.xlsx",
      "fetched_at": "2026-05-12T18:39:24Z"
    },
    {
      "url": "https://www.eci.gov.in/eci-backend/public/all_files/AE-2024-statistical-report-SK/3-List-Of-Political-Parties-Participated.xlsx",
      "fetched_at": "2026-05-12T18:39:24Z"
    }
  ],
  "election": "AcGenJun2024",
  "state": "S21",
  "body": "AC",
  "eci_no": 1,
  "constituency_name": "YUKSOM-TASHIDING (BL)",
  "totals": {
    "electors": 15524,
    "votes_polled": 13604,
    "turnout_pct": 87.63
  },
  "candidates": [
    {
      "rank": 1,
      "name": "Tshering Thendup Bhutia",
      "party_short": "SKM",
      "votes": 8271,
      "vote_share_pct": 60.8,
      "is_winner": true
    },
    {
      "rank": 2,
      "name": "Meewang Gyatso Bhutia",
      "party_short": "SDF",
      "votes": 3459,
      "vote_share_pct": 25.43
    },
    {
      "rank": 3,
      "name": "Jigmey Bhutia",
      "party_short": "CAPS",
      "votes": 1024,
      "vote_share_pct": 7.53
    },
    {
      "rank": 4,
      "name": "Kunzang Sherab Bhutia",
      "party_eci_code": "369",
      "party_short": "BJP",
      "votes": 318,
      "vote_share_pct": 2.34
    },
    {
      "rank": 5,
      "name": "Kamal Lepcha",
      "party_eci_code": "742",
      "party_short": "INC",
      "votes": 170,
      "vote_share_pct": 1.25
    }
  ],
  "nota": {
    "votes": 159,
    "vote_share_pct": 1.17
  },
  "others": {
    "candidate_count": 2,
    "votes": 203,
    "vote_share_pct": 1.49
  },
  "top_n_cutoff": 5,
  "winner": {
    "name": "Tshering Thendup Bhutia",
    "party_short": "SKM",
    "votes": 8271,
    "margin_votes": 4812,
    "margin_pct": 35.37
  }
}
