{
  "$schema": "https://yen-gov.github.io/schemas/result.constituency.schema.json",
  "$schema_version": "3.2",
  "sources": [],
  "election": "AcGenApr2021",
  "state": "S11",
  "body": "AC",
  "eci_no": 40,
  "constituency_name": "MALAPPURAM",
  "totals": {
    "electors": 212076,
    "votes_polled": 161825,
    "turnout_pct": 76.31
  },
  "candidates": [
    {
      "rank": 1,
      "name": "P. Ubaidulla",
      "party_short": "IUML",
      "votes": 93166,
      "vote_share_pct": 57.57,
      "is_winner": true,
      "gender": "M",
      "age": 61,
      "category": "GEN"
    },
    {
      "rank": 2,
      "name": "Paloli Abdurahiman",
      "party_short": "CPI(M)",
      "votes": 57958,
      "vote_share_pct": 35.82,
      "gender": "M",
      "age": 68,
      "category": "GEN"
    },
    {
      "rank": 3,
      "name": "Areekkad Sethumadhavan",
      "party_short": "BJP",
      "votes": 5883,
      "vote_share_pct": 3.64,
      "gender": "M",
      "age": 46,
      "category": "GEN"
    },
    {
      "rank": 4,
      "name": "E.c. Ayisha",
      "party_short": "WPOI",
      "votes": 3194,
      "vote_share_pct": 1.97,
      "gender": "F",
      "age": 60,
      "category": "GEN"
    },
    {
      "rank": 5,
      "name": "Prasobh .t",
      "party_short": "BSP",
      "votes": 321,
      "vote_share_pct": 0.2,
      "gender": "M",
      "age": 28,
      "category": "SC"
    }
  ],
  "nota": {
    "votes": 994,
    "vote_share_pct": 0.61
  },
  "others": {
    "candidate_count": 1,
    "votes": 309,
    "vote_share_pct": 0.19
  },
  "top_n_cutoff": 5,
  "winner": {
    "name": "P. Ubaidulla",
    "party_short": "IUML",
    "votes": 93166,
    "margin_votes": 35208,
    "margin_pct": 21.76
  }
}
