{
  "$schema": "https://yen-gov.github.io/schemas/result.constituency.schema.json",
  "$schema_version": "3.2",
  "sources": [],
  "election": "AcGenFeb2017",
  "state": "S19",
  "body": "AC",
  "eci_no": 20,
  "constituency_name": "Attari",
  "totals": {
    "electors": 173543,
    "votes_polled": 130118,
    "turnout_pct": 74.98
  },
  "candidates": [
    {
      "rank": 1,
      "name": "TARSEM SINGH D.C.",
      "party_short": "INC",
      "votes": 55335,
      "vote_share_pct": 42.53,
      "is_winner": true,
      "gender": "M",
      "age": 67,
      "category": "SC"
    },
    {
      "rank": 2,
      "name": "GULZAR SINGH RANIKE",
      "party_short": "SAD",
      "votes": 45133,
      "vote_share_pct": 34.69,
      "gender": "M",
      "age": 59,
      "category": "SC"
    },
    {
      "rank": 3,
      "name": "JASWINDER SINGH JAHANGIR",
      "party_short": "AAAP",
      "votes": 22558,
      "vote_share_pct": 17.34,
      "gender": "M",
      "age": 39,
      "category": "SC"
    },
    {
      "rank": 4,
      "name": "GURDEEP SINGH",
      "party_short": "CPI",
      "votes": 2581,
      "vote_share_pct": 1.98,
      "gender": "M",
      "age": 55,
      "category": "SC"
    },
    {
      "rank": 5,
      "name": "SUKHWANTJIT KAUR",
      "party_short": "BSP",
      "votes": 1088,
      "vote_share_pct": 0.84,
      "gender": "F",
      "age": 51,
      "category": "SC"
    }
  ],
  "nota": {
    "votes": 900,
    "vote_share_pct": 0.69
  },
  "others": {
    "candidate_count": 6,
    "votes": 2523,
    "vote_share_pct": 1.95
  },
  "top_n_cutoff": 5,
  "winner": {
    "name": "TARSEM SINGH D.C.",
    "party_short": "INC",
    "votes": 55335,
    "margin_votes": 10202,
    "margin_pct": 7.84
  }
}
