{
  "$schema": "https://yen-gov.github.io/schemas/result.constituency.schema.json",
  "$schema_version": "3.2",
  "sources": [],
  "election": "AcGenFeb2022",
  "state": "S24",
  "body": "AC",
  "eci_no": 323,
  "constituency_name": "Gorakhpur Rural",
  "totals": {
    "electors": 419269,
    "votes_polled": 254865,
    "turnout_pct": 60.79
  },
  "candidates": [
    {
      "rank": 1,
      "name": "BIPIN SINGH",
      "party_short": "BJP",
      "votes": 126376,
      "vote_share_pct": 49.59,
      "is_winner": true,
      "gender": "M",
      "age": 56,
      "category": "GEN"
    },
    {
      "rank": 2,
      "name": "VIJAY BAHADUR YADAV",
      "party_short": "SP",
      "votes": 102306,
      "vote_share_pct": 40.14,
      "gender": "M",
      "age": 52,
      "category": "GEN"
    },
    {
      "rank": 3,
      "name": "DARA SINGH NISHAD",
      "party_short": "BSP",
      "votes": 15982,
      "vote_share_pct": 6.27,
      "gender": "M",
      "age": 53,
      "category": "GEN"
    },
    {
      "rank": 4,
      "name": "MOHD. ISLAM",
      "party_short": "AIMIM",
      "votes": 3519,
      "vote_share_pct": 1.38,
      "gender": "M",
      "age": 50,
      "category": "GEN"
    },
    {
      "rank": 5,
      "name": "DEVENDRA NISHAD MAHARA",
      "party_short": "INC",
      "votes": 1492,
      "vote_share_pct": 0.59,
      "gender": "M",
      "age": 46,
      "category": "GEN"
    }
  ],
  "nota": {
    "votes": 1053,
    "vote_share_pct": 0.41
  },
  "others": {
    "candidate_count": 10,
    "votes": 4137,
    "vote_share_pct": 1.63
  },
  "top_n_cutoff": 5,
  "winner": {
    "name": "BIPIN SINGH",
    "party_short": "BJP",
    "votes": 126376,
    "margin_votes": 24070,
    "margin_pct": 9.44
  }
}
