{
  "$schema": "https://yen-gov.github.io/schemas/result.constituency.schema.json",
  "$schema_version": "3.1",
  "sources": [
    {
      "url": "https://www.eci.gov.in/eci-backend/public//all_files/election_report/Jharkhand_Legislative_Assembly_Election__2024_2024/10-Detailed_Results_1744892172.xlsx",
      "fetched_at": "2026-05-11T17:41:33Z"
    },
    {
      "url": "https://www.eci.gov.in/eci-backend/public//all_files/election_report/Jharkhand_Legislative_Assembly_Election__2024_2024/3-List_Of_Political_Parties_Participated_1744890626.xlsx",
      "fetched_at": "2026-05-11T17:41:33Z"
    }
  ],
  "election": "AcGenNov2024",
  "state": "S27",
  "body": "AC",
  "eci_no": 44,
  "constituency_name": "BAHARAGORA",
  "totals": {
    "electors": 240151,
    "votes_polled": 191264,
    "turnout_pct": 79.64
  },
  "candidates": [
    {
      "rank": 1,
      "name": "SAMIR KUMAR MOHANTY",
      "party_short": "JMM",
      "votes": 96870,
      "vote_share_pct": 50.65,
      "is_winner": true
    },
    {
      "rank": 2,
      "name": "DINESHANANDA GOSWAMI",
      "party_short": "BJP",
      "votes": 78745,
      "vote_share_pct": 41.17
    },
    {
      "rank": 3,
      "name": "SWAPAN KUMAR MAHATO",
      "party_short": "CPI(M)",
      "votes": 4518,
      "vote_share_pct": 2.36
    },
    {
      "rank": 4,
      "name": "RAM MURMU",
      "party_short": "IND",
      "votes": 2644,
      "vote_share_pct": 1.38
    },
    {
      "rank": 5,
      "name": "PHANI BHUSHAN MAHATO",
      "party_short": "IND",
      "votes": 1625,
      "vote_share_pct": 0.85
    }
  ],
  "nota": {
    "votes": 2495,
    "vote_share_pct": 1.3
  },
  "others": {
    "candidate_count": 9,
    "votes": 4367,
    "vote_share_pct": 2.28
  },
  "top_n_cutoff": 5,
  "winner": {
    "name": "SAMIR KUMAR MOHANTY",
    "party_short": "JMM",
    "votes": 96870,
    "margin_votes": 18125,
    "margin_pct": 9.48
  }
}
