{
  "$schema": "https://yen-gov.github.io/schemas/result.constituency.schema.json",
  "$schema_version": "3.2",
  "sources": [],
  "election": "AcGenMay2023",
  "state": "S10",
  "body": "AC",
  "eci_no": 123,
  "constituency_name": "Sringeri",
  "totals": {
    "electors": 170579,
    "votes_polled": 141580,
    "turnout_pct": 83.0
  },
  "candidates": [
    {
      "rank": 1,
      "name": "T.d.rajegowda",
      "party_short": "INC",
      "votes": 59171,
      "vote_share_pct": 41.79,
      "is_winner": true,
      "gender": "M",
      "age": 63,
      "category": "GEN"
    },
    {
      "rank": 2,
      "name": "D.n.jeevaraja.",
      "party_short": "BJP",
      "votes": 58970,
      "vote_share_pct": 41.65,
      "gender": "M",
      "age": 59,
      "category": "GEN"
    },
    {
      "rank": 3,
      "name": "Sudhakara.s.shetty",
      "party_short": "JD(S)",
      "votes": 19417,
      "vote_share_pct": 13.71,
      "gender": "M",
      "age": 65,
      "category": "GEN"
    },
    {
      "rank": 4,
      "name": "Rajan Gowda H.s.",
      "party_short": "AAAP",
      "votes": 1150,
      "vote_share_pct": 0.81,
      "gender": "M",
      "age": 40,
      "category": "GEN"
    },
    {
      "rank": 5,
      "name": "K.m.gopala",
      "party_short": "BSP",
      "votes": 818,
      "vote_share_pct": 0.58,
      "gender": "M",
      "age": 63,
      "category": "SC"
    }
  ],
  "nota": {
    "votes": 678,
    "vote_share_pct": 0.48
  },
  "others": {
    "candidate_count": 7,
    "votes": 1376,
    "vote_share_pct": 0.97
  },
  "top_n_cutoff": 5,
  "winner": {
    "name": "T.d.rajegowda",
    "party_short": "INC",
    "votes": 59171,
    "margin_votes": 201,
    "margin_pct": 0.14
  }
}
