{
  "$schema": "https://yen-gov.github.io/schemas/result.constituency.schema.json",
  "$schema_version": "3.2",
  "sources": [],
  "election": "AcGenFeb2017",
  "state": "S28",
  "body": "AC",
  "eci_no": 7,
  "constituency_name": "Kedarnath",
  "totals": {
    "electors": 86135,
    "votes_polled": 56204,
    "turnout_pct": 65.25
  },
  "candidates": [
    {
      "rank": 1,
      "name": "MANOJ RAWAT",
      "party_short": "INC",
      "votes": 13906,
      "vote_share_pct": 24.74,
      "is_winner": true,
      "gender": "M",
      "age": 47,
      "category": "GEN"
    },
    {
      "rank": 2,
      "name": "KULDEEP SINGH RAWAT",
      "party_short": "IND",
      "votes": 13037,
      "vote_share_pct": 23.2,
      "gender": "M",
      "age": 41,
      "category": "GEN"
    },
    {
      "rank": 3,
      "name": "ASHA",
      "party_short": "IND",
      "votes": 11786,
      "vote_share_pct": 20.97,
      "gender": "F",
      "age": 47,
      "category": "GEN"
    },
    {
      "rank": 4,
      "name": "SHAILA RANI RAWAT",
      "party_short": "BJP",
      "votes": 11472,
      "vote_share_pct": 20.41,
      "gender": "F",
      "age": 61,
      "category": "GEN"
    },
    {
      "rank": 5,
      "name": "GANGADHAR",
      "party_short": "UKKD",
      "votes": 2734,
      "vote_share_pct": 4.86,
      "gender": "M",
      "age": 61,
      "category": "GEN"
    }
  ],
  "nota": {
    "votes": 715,
    "vote_share_pct": 1.27
  },
  "others": {
    "candidate_count": 4,
    "votes": 2554,
    "vote_share_pct": 4.55
  },
  "top_n_cutoff": 5,
  "winner": {
    "name": "MANOJ RAWAT",
    "party_short": "INC",
    "votes": 13906,
    "margin_votes": 869,
    "margin_pct": 1.55
  }
}
