{
  "$schema": "https://yen-gov.github.io/schemas/result.constituency.schema.json",
  "$schema_version": "3.2",
  "sources": [],
  "election": "AcGenDec2019",
  "state": "S27",
  "body": "AC",
  "eci_no": 47,
  "constituency_name": "Jugsalai",
  "totals": {
    "electors": 327048,
    "votes_polled": 216313,
    "turnout_pct": 66.14105574716861
  },
  "candidates": [
    {
      "rank": 1,
      "name": "MANGAL KALINDI",
      "party_short": "JMM",
      "votes": 88581,
      "vote_share_pct": 40.950382085219104,
      "is_winner": true,
      "gender": "M",
      "age": 42,
      "category": "SC"
    },
    {
      "rank": 2,
      "name": "MUCHIRAM BAURI",
      "party_short": "BJP",
      "votes": 66647,
      "vote_share_pct": 30.81044597412083,
      "gender": "M",
      "age": 41,
      "category": "SC"
    },
    {
      "rank": 3,
      "name": "RAM CHANDRA SAHIS",
      "party_short": "AJSUP",
      "votes": 46779,
      "vote_share_pct": 21.625607337515547,
      "gender": "M",
      "age": 44,
      "category": "SC"
    },
    {
      "rank": 4,
      "name": "RAMCHANDRA PASWAN",
      "party_short": "JVM",
      "votes": 3008,
      "vote_share_pct": 1.3905775427274365,
      "gender": "M",
      "age": 61,
      "category": "SC"
    },
    {
      "rank": 5,
      "name": "BIJAY MUKHI",
      "party_short": "APoI",
      "votes": 1922,
      "vote_share_pct": 0.8885272729794326,
      "gender": "M",
      "age": 41,
      "category": "SC"
    }
  ],
  "nota": {
    "votes": 3093,
    "vote_share_pct": 1.4298724533430724
  },
  "others": {
    "candidate_count": 5,
    "votes": 6283,
    "vote_share_pct": 2.9
  },
  "top_n_cutoff": 5,
  "winner": {
    "name": "MANGAL KALINDI",
    "party_short": "JMM",
    "votes": 88581,
    "margin_votes": 21934,
    "margin_pct": 10.14
  }
}
