{
  "$schema": "https://yen-gov.github.io/schemas/result.constituency.schema.json",
  "$schema_version": "3.0",
  "sources": [
    {
      "url": "https://www.eci.gov.in/eci-backend/public//all_files/election_report/General_Election_to_the_Legislative_Assembly_of_Tamil_Nadu_2026_2026/10-Detailed_Results_1778165153.xlsx",
      "fetched_at": "2026-05-09T11:59:28Z"
    },
    {
      "url": "https://results.eci.gov.in/ResultAcGenMay2026/partywiseresult-S22.htm",
      "fetched_at": "2026-05-09T11:59:28Z"
    }
  ],
  "election": "AcGenMay2026",
  "state": "S22",
  "body": "AC",
  "eci_no": 198,
  "constituency_name": "ANDIPATTI",
  "totals": {
    "electors": 257997,
    "votes_polled": 217329,
    "turnout_pct": 84.24
  },
  "candidates": [
    {
      "rank": 1,
      "name": "Maharajan.a",
      "party_eci_code": "582",
      "party_short": "DMK",
      "votes": 74324,
      "vote_share_pct": 34.2,
      "is_winner": true
    },
    {
      "rank": 2,
      "name": "Pandi.v",
      "party_eci_code": "3679",
      "party_short": "TVK",
      "votes": 64770,
      "vote_share_pct": 29.8
    },
    {
      "rank": 3,
      "name": "Logirajan.a",
      "party_eci_code": "75",
      "party_short": "ADMK",
      "votes": 63343,
      "vote_share_pct": 29.15
    },
    {
      "rank": 4,
      "name": "Gomathi .m",
      "party_short": "NTK",
      "votes": 10346,
      "vote_share_pct": 4.76
    },
    {
      "rank": 5,
      "name": "Chellapandiyan.s",
      "party_short": "AIPTMMK",
      "votes": 586,
      "vote_share_pct": 0.27
    }
  ],
  "nota": {
    "votes": 1028,
    "vote_share_pct": 0.47
  },
  "others": {
    "candidate_count": 13,
    "votes": 2932,
    "vote_share_pct": 1.34
  },
  "top_n_cutoff": 5,
  "winner": {
    "name": "Maharajan.a",
    "party_eci_code": "582",
    "party_short": "DMK",
    "votes": 74324,
    "margin_votes": 9554,
    "margin_pct": 4.4
  }
}
