{
  "$schema": "https://yen-gov.github.io/schemas/result.constituency.schema.json",
  "$schema_version": "3.0",
  "sources": [
    {
      "url": "https://www.eci.gov.in/eci-backend/public//all_files/election_report/General_Election_to_the_Legislative_Assembly_of_Kerala_2026_2026/10-Detailed_Results_1778164525.xlsx",
      "fetched_at": "2026-05-09T11:59:22Z"
    },
    {
      "url": "https://results.eci.gov.in/ResultAcGenMay2026/partywiseresult-S11.htm",
      "fetched_at": "2026-05-09T11:59:24Z"
    }
  ],
  "election": "AcGenMay2026",
  "state": "S11",
  "body": "AC",
  "eci_no": 93,
  "constituency_name": "PALA",
  "totals": {
    "electors": 176726,
    "votes_polled": 135851,
    "turnout_pct": 76.87
  },
  "candidates": [
    {
      "rank": 1,
      "name": "Mani C Kappen",
      "party_short": "IND",
      "votes": 50799,
      "vote_share_pct": 37.39,
      "is_winner": true
    },
    {
      "rank": 2,
      "name": "Jose K Mani",
      "party_short": "KEC(M)",
      "votes": 47808,
      "vote_share_pct": 35.19
    },
    {
      "rank": 3,
      "name": "Shone George",
      "party_eci_code": "369",
      "party_short": "BJP",
      "votes": 35304,
      "vote_share_pct": 25.99
    },
    {
      "rank": 4,
      "name": "Adv.rony Nedumpallil",
      "party_short": "AAAP",
      "votes": 506,
      "vote_share_pct": 0.37
    },
    {
      "rank": 5,
      "name": "C G Babu",
      "party_short": "IND",
      "votes": 325,
      "vote_share_pct": 0.24
    }
  ],
  "nota": {
    "votes": 583,
    "vote_share_pct": 0.43
  },
  "others": {
    "candidate_count": 2,
    "votes": 526,
    "vote_share_pct": 0.39
  },
  "top_n_cutoff": 5,
  "winner": {
    "name": "Mani C Kappen",
    "party_short": "IND",
    "votes": 50799,
    "margin_votes": 2991,
    "margin_pct": 2.2
  }
}
