{
  "$schema": "https://yen-gov.github.io/schemas/result.constituency.schema.json",
  "$schema_version": "3.2",
  "sources": [],
  "election": "AcGenFeb2020",
  "state": "U05",
  "body": "AC",
  "eci_no": 61,
  "constituency_name": "GANDHI NAGAR",
  "totals": {
    "electors": 182831,
    "votes_polled": 114507,
    "turnout_pct": 62.62996975348819
  },
  "candidates": [
    {
      "rank": 1,
      "name": "ANIL KUMAR BAJPAI",
      "party_short": "BJP",
      "votes": 48824,
      "vote_share_pct": 42.63844131799803,
      "is_winner": true,
      "gender": "M",
      "age": 62,
      "category": "GEN"
    },
    {
      "rank": 2,
      "name": "NAVEEN CHAUDHARY",
      "party_short": "AAAP",
      "votes": 42745,
      "vote_share_pct": 37.32959557057647,
      "gender": "M",
      "age": 54,
      "category": "GEN"
    },
    {
      "rank": 3,
      "name": "ARVINDER SINGH LOVELY",
      "party_short": "INC",
      "votes": 21913,
      "vote_share_pct": 19.136821329700368,
      "gender": "M",
      "age": 51,
      "category": "GEN"
    },
    {
      "rank": 4,
      "name": "TIKRAJ SINGH",
      "party_short": "BSP",
      "votes": 357,
      "vote_share_pct": 0.31177133275694935,
      "gender": "M",
      "age": 38,
      "category": "SC"
    },
    {
      "rank": 5,
      "name": "MUKESH KUMAR",
      "party_short": "IND",
      "votes": 164,
      "vote_share_pct": 0.14322268507602154,
      "gender": "M",
      "age": 36,
      "category": "GEN"
    }
  ],
  "nota": {
    "votes": 326,
    "vote_share_pct": 0.2846987520413599
  },
  "others": {
    "candidate_count": 2,
    "votes": 178,
    "vote_share_pct": 0.16
  },
  "top_n_cutoff": 5,
  "winner": {
    "name": "ANIL KUMAR BAJPAI",
    "party_short": "BJP",
    "votes": 48824,
    "margin_votes": 6079,
    "margin_pct": 5.31
  }
}
