{
  "$schema": "https://yen-gov.github.io/schemas/result.constituency.schema.json",
  "$schema_version": "3.1",
  "sources": [
    {
      "url": "https://www.eci.gov.in/eci-backend/public//all_files/election_report/General_Election_to_the_Legislative_Assembly_of_Kerala_2026_2026/10-Detailed_Results_1778164525.xlsx",
      "fetched_at": "2026-05-09T11:59:22Z"
    },
    {
      "url": "https://results.eci.gov.in/ResultAcGenMay2026/partywiseresult-S11.htm",
      "fetched_at": "2026-05-09T11:59:24Z"
    }
  ],
  "election": "AcGenMay2026",
  "state": "S11",
  "body": "AC",
  "eci_no": 13,
  "constituency_name": "THALASSERY",
  "totals": {
    "electors": 186116,
    "votes_polled": 144287,
    "turnout_pct": 77.53
  },
  "candidates": [
    {
      "rank": 1,
      "name": "Karayi Rajan",
      "party_eci_code": "547",
      "party_short": "CPI(M)",
      "votes": 69743,
      "vote_share_pct": 48.34,
      "is_winner": true
    },
    {
      "rank": 2,
      "name": "Saju K P",
      "party_eci_code": "742",
      "party_short": "INC",
      "votes": 49220,
      "vote_share_pct": 34.11
    },
    {
      "rank": 3,
      "name": "O Nidheesh",
      "party_eci_code": "369",
      "party_short": "BJP",
      "votes": 22754,
      "vote_share_pct": 15.77
    },
    {
      "rank": 4,
      "name": "A C Jalaluddheen",
      "party_short": "SDPI",
      "votes": 1444,
      "vote_share_pct": 1.0
    },
    {
      "rank": 5,
      "name": "Saju V P",
      "party_short": "IND",
      "votes": 240,
      "vote_share_pct": 0.17
    }
  ],
  "nota": {
    "votes": 728,
    "vote_share_pct": 0.5
  },
  "others": {
    "candidate_count": 2,
    "votes": 158,
    "vote_share_pct": 0.11
  },
  "top_n_cutoff": 5,
  "winner": {
    "name": "Karayi Rajan",
    "party_eci_code": "547",
    "party_short": "CPI(M)",
    "votes": 69743,
    "margin_votes": 20523,
    "margin_pct": 14.22
  }
}
