{
  "$schema": "https://yen-gov.github.io/schemas/result.constituency.schema.json",
  "$schema_version": "3.2",
  "sources": [],
  "election": "AcGenDec2017",
  "state": "S06",
  "body": "AC",
  "eci_no": 88,
  "constituency_name": "Keshod",
  "totals": {
    "electors": 225272,
    "votes_polled": 140009,
    "turnout_pct": 62.15
  },
  "candidates": [
    {
      "rank": 1,
      "name": "DEVABHAI PUNJABHAI MALAM",
      "party_short": "BJP",
      "votes": 71425,
      "vote_share_pct": 51.01,
      "is_winner": true,
      "gender": "M",
      "age": 59,
      "category": "GEN"
    },
    {
      "rank": 2,
      "name": "JAYESHKUMAR VALJIBHAI LADANI",
      "party_short": "INC",
      "votes": 60619,
      "vote_share_pct": 43.3,
      "gender": "M",
      "age": 49,
      "category": "GEN"
    },
    {
      "rank": 3,
      "name": "KHIMANANDBHAI GOVINDBHAI JARER",
      "party_short": "NCP",
      "votes": 1155,
      "vote_share_pct": 0.82,
      "gender": "M",
      "age": 53,
      "category": "GEN"
    },
    {
      "rank": 4,
      "name": "SHAILESHKUMAR NAUTTAMLAL PANDYA",
      "party_short": "IND",
      "votes": 859,
      "vote_share_pct": 0.61,
      "gender": "M",
      "age": 35,
      "category": "GEN"
    },
    {
      "rank": 5,
      "name": "JADAVBHAI BACHUBHAI CHUDASAMA",
      "party_short": "GJCP",
      "votes": 774,
      "vote_share_pct": 0.55,
      "gender": "M",
      "age": 52,
      "category": "GEN"
    }
  ],
  "nota": {
    "votes": 1484,
    "vote_share_pct": 1.06
  },
  "others": {
    "candidate_count": 7,
    "votes": 2461,
    "vote_share_pct": 1.76
  },
  "top_n_cutoff": 5,
  "winner": {
    "name": "DEVABHAI PUNJABHAI MALAM",
    "party_short": "BJP",
    "votes": 71425,
    "margin_votes": 10806,
    "margin_pct": 7.72
  }
}
