{
  "$schema": "https://yen-gov.github.io/schemas/result.constituency.schema.json",
  "$schema_version": "3.2",
  "sources": [],
  "election": "AcGenDec2022",
  "state": "S06",
  "body": "AC",
  "eci_no": 69,
  "constituency_name": "Rajkot West",
  "totals": {
    "electors": 354378,
    "votes_polled": 204012,
    "turnout_pct": 57.57
  },
  "candidates": [
    {
      "rank": 1,
      "name": "Dr. Darshita Shah",
      "party_short": "BJP",
      "votes": 138687,
      "vote_share_pct": 67.98,
      "is_winner": true,
      "gender": "F",
      "age": 53,
      "category": "GEN"
    },
    {
      "rank": 2,
      "name": "Kalariya Mansukhbhai Jadavbhai",
      "party_short": "INC",
      "votes": 32712,
      "vote_share_pct": 16.03,
      "gender": "M",
      "age": 62,
      "category": "GEN"
    },
    {
      "rank": 3,
      "name": "Dineshkumar Mohanbhai Joshi",
      "party_short": "AAAP",
      "votes": 26319,
      "vote_share_pct": 12.9,
      "gender": "M",
      "age": 57,
      "category": "GEN"
    },
    {
      "rank": 4,
      "name": "Chamanbhai Savsani",
      "party_short": "BSP",
      "votes": 805,
      "vote_share_pct": 0.39,
      "gender": "M",
      "age": 49,
      "category": "GEN"
    },
    {
      "rank": 5,
      "name": "Mehul Nathwani",
      "party_short": "IND",
      "votes": 617,
      "vote_share_pct": 0.3,
      "gender": "M",
      "age": 44,
      "category": "GEN"
    }
  ],
  "nota": {
    "votes": 3419,
    "vote_share_pct": 1.68
  },
  "others": {
    "candidate_count": 8,
    "votes": 1453,
    "vote_share_pct": 0.72
  },
  "top_n_cutoff": 5,
  "winner": {
    "name": "Dr. Darshita Shah",
    "party_short": "BJP",
    "votes": 138687,
    "margin_votes": 105975,
    "margin_pct": 51.95
  }
}
