{
  "$schema": "https://yen-gov.github.io/schemas/result.constituency.schema.json",
  "$schema_version": "3.2",
  "sources": [],
  "election": "AcGenApr2021",
  "state": "S11",
  "body": "AC",
  "eci_no": 12,
  "constituency_name": "DHARMADAM",
  "totals": {
    "electors": 193486,
    "votes_polled": 160247,
    "turnout_pct": 82.82
  },
  "candidates": [
    {
      "rank": 1,
      "name": "Pinarayi Vijayan",
      "party_short": "CPI(M)",
      "votes": 95522,
      "vote_share_pct": 59.61,
      "is_winner": true,
      "gender": "M",
      "age": 77,
      "category": "GEN"
    },
    {
      "rank": 2,
      "name": "C. Raghunathan",
      "party_short": "INC",
      "votes": 45399,
      "vote_share_pct": 28.33,
      "gender": "M",
      "age": 64,
      "category": "GEN"
    },
    {
      "rank": 3,
      "name": "C. K. Padmanabhan",
      "party_short": "BJP",
      "votes": 14623,
      "vote_share_pct": 9.13,
      "gender": "M",
      "age": 72,
      "category": "GEN"
    },
    {
      "rank": 4,
      "name": "Basheer Kannadiparamba",
      "party_short": "SDPI",
      "votes": 2280,
      "vote_share_pct": 1.42,
      "gender": "M",
      "age": 44,
      "category": "GEN"
    },
    {
      "rank": 5,
      "name": "Valayar Bhagyavathi",
      "party_short": "IND",
      "votes": 1753,
      "vote_share_pct": 1.09,
      "gender": "F",
      "age": 40,
      "category": "GEN"
    }
  ],
  "nota": {
    "votes": 400,
    "vote_share_pct": 0.25
  },
  "others": {
    "candidate_count": 3,
    "votes": 270,
    "vote_share_pct": 0.17
  },
  "top_n_cutoff": 5,
  "winner": {
    "name": "Pinarayi Vijayan",
    "party_short": "CPI(M)",
    "votes": 95522,
    "margin_votes": 50123,
    "margin_pct": 31.28
  }
}
