{
  "$schema": "https://yen-gov.github.io/schemas/result.constituency.schema.json",
  "$schema_version": "3.2",
  "sources": [],
  "election": "AcGenFeb2023",
  "state": "S23",
  "body": "AC",
  "eci_no": 24,
  "constituency_name": "Ramchandraghat (ST)",
  "totals": {
    "electors": 41608,
    "votes_polled": 38018,
    "turnout_pct": 91.37
  },
  "candidates": [
    {
      "rank": 1,
      "name": "Ranjit Debbarma",
      "party_short": "TMP",
      "votes": 23143,
      "vote_share_pct": 60.87,
      "is_winner": true,
      "gender": "M",
      "age": 59,
      "category": "ST"
    },
    {
      "rank": 2,
      "name": "Ranjit Debbarma",
      "party_short": "CPI(M)",
      "votes": 6941,
      "vote_share_pct": 18.26,
      "gender": "M",
      "age": 72,
      "category": "ST"
    },
    {
      "rank": 3,
      "name": "Sanjib Debbarma",
      "party_short": "IND",
      "votes": 6010,
      "vote_share_pct": 15.81,
      "gender": "M",
      "age": 54,
      "category": "ST"
    },
    {
      "rank": 4,
      "name": "Prasanta Debbarma",
      "party_short": "IPFT",
      "votes": 932,
      "vote_share_pct": 2.45,
      "gender": "M",
      "age": 47,
      "category": "ST"
    },
    {
      "rank": 5,
      "name": "Sahajit Debbarma",
      "party_short": "IND",
      "votes": 598,
      "vote_share_pct": 1.57,
      "gender": "M",
      "age": 28,
      "category": "ST"
    }
  ],
  "nota": {
    "votes": 394,
    "vote_share_pct": 1.04
  },
  "top_n_cutoff": 5,
  "winner": {
    "name": "Ranjit Debbarma",
    "party_short": "TMP",
    "votes": 23143,
    "margin_votes": 16202,
    "margin_pct": 42.62
  },
  "others": null
}
