{
  "$schema": "https://yen-gov.github.io/schemas/result.constituency.schema.json",
  "$schema_version": "3.2",
  "sources": [],
  "election": "AcGenMar2022",
  "state": "S14",
  "body": "AC",
  "eci_no": 37,
  "constituency_name": "Kakching",
  "totals": {
    "electors": 30499,
    "votes_polled": 27135,
    "turnout_pct": 88.97
  },
  "candidates": [
    {
      "rank": 1,
      "name": "MAYANGLAMBAM RAMESHWAR SINGH",
      "party_short": "NPEP",
      "votes": 8546,
      "vote_share_pct": 31.49,
      "is_winner": true,
      "gender": "M",
      "age": 53,
      "category": "SC"
    },
    {
      "rank": 2,
      "name": "Yengkhom Surchandra Singh",
      "party_short": "BJP",
      "votes": 7341,
      "vote_share_pct": 27.05,
      "gender": "M",
      "age": 70,
      "category": "SC"
    },
    {
      "rank": 3,
      "name": "KSHETRIMAYUM KENNEDY SINGH",
      "party_short": "INC",
      "votes": 5873,
      "vote_share_pct": 21.64,
      "gender": "M",
      "age": 48,
      "category": "SC"
    },
    {
      "rank": 4,
      "name": "Naorem Nabachandra Singh",
      "party_short": "JD(U)",
      "votes": 2451,
      "vote_share_pct": 9.03,
      "gender": "M",
      "age": 58,
      "category": "SC"
    },
    {
      "rank": 5,
      "name": "YENGKHOM NILACHANDRA SINGH",
      "party_short": "NCP",
      "votes": 2009,
      "vote_share_pct": 7.4,
      "gender": "M",
      "age": 61,
      "category": "SC"
    }
  ],
  "nota": {
    "votes": 239,
    "vote_share_pct": 0.88
  },
  "others": {
    "candidate_count": 1,
    "votes": 676,
    "vote_share_pct": 2.49
  },
  "top_n_cutoff": 5,
  "winner": {
    "name": "MAYANGLAMBAM RAMESHWAR SINGH",
    "party_short": "NPEP",
    "votes": 8546,
    "margin_votes": 1205,
    "margin_pct": 4.44
  }
}
